{
  "$schema": "http://json-schema.org/draft-04/schema#",
  "type": "object",
  "properties": {
    "code": {
      "type": "string"
    },
    "title": {
      "type": "string"
    },
    "description": {
      "type": "string"
    },
    "prerequisite": {
      "type": "array",
      "items": [
        {
          "type": "object",
          "properties": {
            "code": {
              "type": "string"
            },
            "title": {
              "type": "string"
            },
            "description": {
              "type": "string"
            }
          },
          "required": ["code", "title", "description"]
        }
      ]
    }
  },
  "required": ["code", "title", "description", "prerequisite"]
}
